"Chuck Norris doesn't dodge bullets, bullets dodge Chuck Norris"
Chuck Norris once saw a 24 hour video. He saw it 3 times that day.
Chuck Norris can speak braille
"If Chuck Norris was a spartan the movie would be called ""1"""
Chuck Norris can squeeze orange juice from a banana
How many push-ups can Chuck Norris do? All of them.
Chuck Norris doesn't travel at the speed of light. Light travels at the speed of Chuck Norris.
Chuck Norris sleeps with a pillow under his gun
Chuck Norris's beard can shave a razor
FUCK YOU
